{"state_machine_name":"application.window.lifecycle","state_machine_version":"0.1.0","subject_entity_kinds":["application.window"],"states":[{"name":"created","terminal":false,"description":"Window incarnation exists but visibility/readiness is not proven.","proof_dimension":"lifecycle","entry_requirements":["Exact Application Session and Provider generation exist."]},{"name":"visible","terminal":false,"description":"Window is visible; application readiness remains separate.","proof_dimension":"lifecycle","entry_requirements":["Fresh Window Observation exists."]},{"name":"hidden","terminal":false,"description":"Window exists but is not visible.","proof_dimension":"lifecycle","entry_requirements":["Fresh observation exists."]},{"name":"degraded","terminal":false,"description":"Geometry/display/input state is partial or stale.","proof_dimension":"lifecycle","entry_requirements":["Limitations exist."]},{"name":"replaced","terminal":true,"description":"A recreated Window generation supersedes this incarnation.","proof_dimension":"lifecycle","entry_requirements":["Replacement Window exists."]},{"name":"closed","terminal":true,"description":"Window destruction is observed.","proof_dimension":"lifecycle","entry_requirements":["Close observation exists."]},{"name":"unknown","terminal":false,"description":"Provider cannot prove current Window state.","proof_dimension":"lifecycle","entry_requirements":["Observation gap exists."]}],"initial_states":["created"],"transitions":[{"transition_name":"create","from_states":[null],"to_state":"created","transition_class":"normal","authority_classes":["provider","ptah_control_plane"],"side_effecting":false,"required_preconditions":["Exact Session/generation exists."],"required_evidence_kinds":["receipt","window_observation"],"required_receipt_proof_levels":[]},{"transition_name":"show","from_states":["created","hidden","degraded","unknown"],"to_state":"visible","transition_class":"normal","authority_classes":["provider","ptah_control_plane"],"side_effecting":false,"required_preconditions":["Fresh visibility observation exists."],"required_evidence_kinds":["window_observation"],"required_receipt_proof_levels":[]},{"transition_name":"hide","from_states":["visible","degraded"],"to_state":"hidden","transition_class":"normal","authority_classes":["provider","ptah_control_plane"],"side_effecting":false,"required_preconditions":["Fresh hidden observation exists."],"required_evidence_kinds":["window_observation"],"required_receipt_proof_levels":[]},{"transition_name":"degrade","from_states":["created","visible","hidden","unknown"],"to_state":"degraded","transition_class":"normal","authority_classes":["provider","ptah_control_plane"],"side_effecting":false,"required_preconditions":["Bounded degraded dimension exists."],"required_evidence_kinds":["window_observation"],"required_receipt_proof_levels":[]},{"transition_name":"replace","from_states":["created","visible","hidden","degraded","unknown"],"to_state":"replaced","transition_class":"migration","authority_classes":["provider","ptah_control_plane"],"side_effecting":false,"required_preconditions":["New Window generation exists."],"required_evidence_kinds":["receipt","window_observation"],"required_receipt_proof_levels":[]},{"transition_name":"close","from_states":["created","visible","hidden","degraded","unknown"],"to_state":"closed","transition_class":"normal","authority_classes":["provider","ptah_control_plane"],"side_effecting":false,"required_preconditions":["Window destruction is observed."],"required_evidence_kinds":["window_observation"],"required_receipt_proof_levels":[]},{"transition_name":"lose_state","from_states":["created","visible","hidden","degraded"],"to_state":"unknown","transition_class":"recovery","authority_classes":["provider","ptah_control_plane"],"side_effecting":false,"required_preconditions":["Provider continuity is lost."],"required_evidence_kinds":["window_observation"],"required_receipt_proof_levels":[]}],"unknown_state_policy":"reject","migration_policy":{"state_mapping_required_for_breaking_change":true,"unmapped_state_behavior":"manual_review","migration_definition_refs":[]},"extensions":{}}