{
  "state_machine_name": "activity_request.lifecycle",
  "state_machine_version": "0.1.0",
  "subject_entity_kinds": ["core.activity_request"],
  "states": [
    {"name":"submitted","description":"Caller submission was durably received for validation.","terminal":false,"proof_dimension":"lifecycle","entry_requirements":["Request contract validates structurally."]},
    {"name":"validating","description":"Authorization, Workspace, parameters, policy, budgets and idempotent-submission handling are being checked.","terminal":false,"proof_dimension":"lifecycle","entry_requirements":["Validation execution is current."]},
    {"name":"accepted","description":"A durable Activity was created and linked to this request.","terminal":true,"proof_dimension":"lifecycle","entry_requirements":["Accepted Activity reference and decision outcome exist."]},
    {"name":"rejected","description":"Request was denied or invalid and no Activity was created.","terminal":true,"proof_dimension":"lifecycle","entry_requirements":["Typed rejection outcome exists."]},
    {"name":"expired","description":"Request expired before acceptance.","terminal":true,"proof_dimension":"lifecycle","entry_requirements":["Expiry authority/time and outcome exist."]},
    {"name":"withdrawn","description":"Authorized requestor withdrew the request before acceptance.","terminal":true,"proof_dimension":"lifecycle","entry_requirements":["Withdrawal authority and outcome exist."]}
  ],
  "initial_states": ["submitted"],
  "transitions": [
    {"transition_name":"submit","from_states":[null],"to_state":"submitted","transition_class":"normal","authority_classes":["caller","ptah_control_plane"],"side_effecting":false,"required_preconditions":["Canonical request identity and submission payload exist."],"required_evidence_kinds":[],"required_receipt_proof_levels":[]},
    {"transition_name":"validate","from_states":["submitted"],"to_state":"validating","transition_class":"normal","authority_classes":["ptah_control_plane"],"side_effecting":false,"required_preconditions":["Submission is not expired/withdrawn and duplicate handling is resolved."],"required_evidence_kinds":[],"required_receipt_proof_levels":[]},
    {"transition_name":"accept","from_states":["submitted","validating"],"to_state":"accepted","transition_class":"normal","authority_classes":["ptah_control_plane"],"side_effecting":false,"required_preconditions":["Authorization and policy pass; durable Activity exists."],"required_evidence_kinds":["receipt"],"required_receipt_proof_levels":["accepted"]},
    {"transition_name":"reject","from_states":["submitted","validating"],"to_state":"rejected","transition_class":"administrative","authority_classes":["ptah_control_plane","organization_policy"],"side_effecting":false,"required_preconditions":["Typed rejection outcome exists."],"required_evidence_kinds":[],"required_receipt_proof_levels":[]},
    {"transition_name":"expire","from_states":["submitted","validating"],"to_state":"expired","transition_class":"expiry","authority_classes":["ptah_control_plane"],"side_effecting":false,"required_preconditions":["Request expiry elapsed."],"required_evidence_kinds":[],"required_receipt_proof_levels":[],"expiry_clock_authority":"ptah_control_plane"},
    {"transition_name":"withdraw","from_states":["submitted","validating"],"to_state":"withdrawn","transition_class":"cancellation","authority_classes":["caller","workspace_owner","ptah_control_plane"],"side_effecting":false,"required_preconditions":["Withdrawal is authorized and no Activity was accepted."],"required_evidence_kinds":[],"required_receipt_proof_levels":[]}
  ],
  "unknown_state_policy": "reject",
  "migration_policy": {"state_mapping_required_for_breaking_change":true,"unmapped_state_behavior":"manual_review","migration_definition_refs":[]},
  "extensions": {}
}
