{"state_machine_name":"application.application.lifecycle","state_machine_version":"0.1.0","subject_entity_kinds":["application.application"],"states":[{"name":"active","terminal":false,"description":"Application role has an accepted current Revision.","proof_dimension":"lifecycle","entry_requirements":["Current Revision exists."]},{"name":"deprecated","terminal":false,"description":"Application remains addressable but new use is discouraged.","proof_dimension":"lifecycle","entry_requirements":["Deprecation reason exists."]},{"name":"replaced","terminal":true,"description":"A replacement Application identity is recorded.","proof_dimension":"lifecycle","entry_requirements":["Replacement reference exists."]},{"name":"retired","terminal":true,"description":"No new installation or launch is permitted.","proof_dimension":"lifecycle","entry_requirements":["Retirement authority exists."]}],"initial_states":["active"],"transitions":[{"transition_name":"create","from_states":[null],"to_state":"active","transition_class":"normal","authority_classes":["workspace_owner","ptah_control_plane"],"side_effecting":false,"required_preconditions":["Accepted Revision exists."],"required_evidence_kinds":["receipt"],"required_receipt_proof_levels":["accepted"]},{"transition_name":"deprecate","from_states":["active"],"to_state":"deprecated","transition_class":"normal","authority_classes":["workspace_owner","organization_policy"],"side_effecting":false,"required_preconditions":["Reason and migration guidance exist."],"required_evidence_kinds":["receipt"],"required_receipt_proof_levels":[]},{"transition_name":"replace","from_states":["active","deprecated"],"to_state":"replaced","transition_class":"migration","authority_classes":["workspace_owner","ptah_control_plane"],"side_effecting":false,"required_preconditions":["Replacement identity and compatibility path exist."],"required_evidence_kinds":["receipt","migration"],"required_receipt_proof_levels":["accepted"]},{"transition_name":"retire","from_states":["active","deprecated"],"to_state":"retired","transition_class":"normal","authority_classes":["workspace_owner","organization_policy"],"side_effecting":false,"required_preconditions":["Retirement authority and retained history exist."],"required_evidence_kinds":["receipt"],"required_receipt_proof_levels":[]}],"unknown_state_policy":"reject","migration_policy":{"state_mapping_required_for_breaking_change":true,"unmapped_state_behavior":"manual_review","migration_definition_refs":[]},"extensions":{}}