{
  "state_machine_name":"domain.operation_request.lifecycle","state_machine_version":"0.1.0","subject_entity_kinds":["domain.operation_request"],
  "states":[
    {"name":"proposed","description":"Request exists but compatibility/authority is not accepted.","terminal":false,"proof_dimension":"lifecycle","entry_requirements":["Pack, operation, subjects, scope and budget exist."]},
    {"name":"accepted","description":"Request is authorized for compatible execution context.","terminal":false,"proof_dimension":"lifecycle","entry_requirements":["Current compatibility and required authority exist."]},
    {"name":"queued","description":"Accepted request waits for eligible Provider/resources.","terminal":false,"proof_dimension":"lifecycle","entry_requirements":["Dispatch eligibility exists."]},
    {"name":"fulfilled","description":"A Domain Operation Run was created and reached a terminal result.","terminal":true,"proof_dimension":"lifecycle","entry_requirements":["Run and outcome refs exist."]},
    {"name":"rejected","description":"Request was rejected before execution.","terminal":true,"proof_dimension":"lifecycle","entry_requirements":["Rejection authority and reason exist."]},
    {"name":"cancelled","description":"Request was cancelled before fulfillment.","terminal":true,"proof_dimension":"lifecycle","entry_requirements":["Cancellation evidence exists."]},
    {"name":"expired","description":"Request expired before execution.","terminal":true,"proof_dimension":"lifecycle","entry_requirements":["Expiry evidence exists."]},
    {"name":"blocked","description":"Compatibility, credential, resource or policy condition is unsatisfied.","terminal":false,"proof_dimension":"lifecycle","entry_requirements":["Structured blocker exists."]}
  ],
  "initial_states":["proposed"],
  "transitions":[
    {"transition_name":"create","from_states":[null],"to_state":"proposed","transition_class":"normal","authority_classes":["caller","ptah_control_plane"],"side_effecting":false,"required_preconditions":["Requested scope and mutation class are explicit."],"required_evidence_kinds":["receipt"],"required_receipt_proof_levels":["accepted"]},
    {"transition_name":"accept","from_states":["proposed","blocked"],"to_state":"accepted","transition_class":"administrative","authority_classes":["workspace_owner","organization_policy","ptah_control_plane"],"side_effecting":false,"required_preconditions":["Compatibility is current and mutation authority exists where required."],"required_evidence_kinds":["receipt","compatibility","authorization"],"required_receipt_proof_levels":["accepted"]},
    {"transition_name":"queue","from_states":["accepted","blocked"],"to_state":"queued","transition_class":"normal","authority_classes":["ptah_control_plane"],"side_effecting":false,"required_preconditions":["Fresh dispatch eligibility exists."],"required_evidence_kinds":["receipt","dispatch_eligibility"],"required_receipt_proof_levels":["accepted"]},
    {"transition_name":"fulfill","from_states":["accepted","queued"],"to_state":"fulfilled","transition_class":"normal","authority_classes":["ptah_control_plane"],"side_effecting":false,"required_preconditions":["Related Domain Run reached terminal result with retained coverage."],"required_evidence_kinds":["receipt","domain_run","coverage"],"required_receipt_proof_levels":["operation_completed"]},
    {"transition_name":"reject","from_states":["proposed","blocked"],"to_state":"rejected","transition_class":"administrative","authority_classes":["workspace_owner","organization_policy"],"side_effecting":false,"required_preconditions":["Reason and authority exist."],"required_evidence_kinds":["receipt"],"required_receipt_proof_levels":["accepted"]},
    {"transition_name":"cancel","from_states":["proposed","accepted","queued","blocked"],"to_state":"cancelled","transition_class":"cancellation","authority_classes":["caller","workspace_owner","ptah_control_plane"],"side_effecting":false,"required_preconditions":["Cancellation and pending-run disposition exist."],"required_evidence_kinds":["receipt"],"required_receipt_proof_levels":["operation_completed"]},
    {"transition_name":"expire","from_states":["proposed","accepted","queued","blocked"],"to_state":"expired","transition_class":"administrative","authority_classes":["ptah_control_plane"],"side_effecting":false,"required_preconditions":["Expiry reached."],"required_evidence_kinds":["receipt"],"required_receipt_proof_levels":[]},
    {"transition_name":"block","from_states":["proposed","accepted","queued"],"to_state":"blocked","transition_class":"normal","authority_classes":["ptah_control_plane","provider"],"side_effecting":false,"required_preconditions":["Structured blocker and wake condition exist."],"required_evidence_kinds":["receipt"],"required_receipt_proof_levels":[]}
  ],"unknown_state_policy":"reject","migration_policy":{"state_mapping_required_for_breaking_change":true,"unmapped_state_behavior":"manual_review","migration_definition_refs":[]},"extensions":{}
}